nl,pl
"If Lisp to Python conversion and application import are required, recursively convert Lisp collections into Python collections and attempt an import of the specified application, otherwise, convert the named field to bool and queue IO write for submission to the IO executor. Finally, send an email using the backend specified in EMAIL_BACKEND.",if(to_py;load;)else(_convert_boolean_config_value;queue_file_io_task;)send_email;
"If pre-flight code execution is needed, run the pre-flight code specified via exec_lines, otherwise, get a random key out of the first max_iter rows and print a user-friendly contacts table. Then, repeat recursively converting Lisp collections into Python collections while Lisp to Python conversion is required.",if(init_code;)else(get_random_available;list_subcommand;)while(to_py;)
"Insert a list of new documents into an existing collection in the CosmosDB database. If MinHash union is needed, create a MinHash which is the union of the MinHash objects passed as arguments; otherwise, repeat getting info for all filters until filter info retrieval is no longer required.",insert_documents;if(union;)else(while(get_info;))
"List all the projects the user has access to. If projects are listed, while repeating, get information relating to the opening coin toss. Otherwise, serve a JSON representation of events instead.",list_projects;if(while(coin_toss;))else(events;)
"Create a specification dictionary for this layer if a specification is created. Otherwise, repeat returning a map from the input stream while the map reading process is initialized.",if(to_spec;)else(while(_read_map;))
"Send the field definitions to standard out. While the HTTP request is issued, repeatedly issue an HTTP request across the wire via the Python requests library. Then, subscribe to the passed pair¡¯s order book channel.",outputFieldMarkdown;while(request;)subscribe_to_order_book;
"Return the target URI for the request if the target URI is returned, otherwise, create a new managed application definition instead.",if(get_uri;)else(create_or_update_by_id;)
"While addresses are found and the index is written, repeat finding addresses matching the command parameters and making a reST API index file from written files. Then, retrieve all default values for configurable parameters of a function, create a copy of a given endpoint with a new service name, and generate auth tokens tied to a user and specified purpose.",while(_find_addresses;write_index;)_get_default_configurable_parameter_values;copy_endpoint_with_new_service_name;iter_auth_hashes;
"Create a specification dictionary for this layer. If a specification is created, while the data encoding process is initialized, repeat writing the data encoding the ProtocolVersion struct to a stream and evaluating the polynomial of the given Bernstein coefficients using de Casteljau¡¯s algorithm. Otherwise, calculate the width of the given string in this font instead.",to_spec;if(while(write;_cubic_bernstein;))else(measure_string;)
"If the file is associated, while the file upload is initiated, repeat uploading the file associated with the file_name passed to Google Drive in the Music folder. Otherwise, set the exception on the future instead",if(while(upload;))else(set_exception;)
"Repeat adding a certificate revocation list to this store and swapping the methods atom to remove method with key while the certificate revocation list is added and the method swapped. Then, delete an entity from the storage service using its path.",while(add_crl;__remove_method;)delete;
"While the connection is initiated, retrieve the connection to Cloud Text to Speech and obtain info about the session, then, when the session info is retrieved, continuously evaluate layer outputs for x.",while(get_conn;get_session_info;while(get_features;))
"While an exception occurred, display the exception that just occurred. If the stream output is created, open the stream create output and finally write the stream to output, otherwise, given a stream a callback and an optional transform set up the subscription instead.",while(showtraceback;)if(output_stream;)else(subscribe;)
"If the app context is bound, repeatedly bind the app context to the current context while the current context is pushed. Otherwise, detect the operating system instead.",if(while(push;))else(detect_os;)
"Fetch data from NNTP and add the rule name. While label setting is initiated, set the label for a specified object. Finally, retrieve Flask blueprints for every provider that supports it.",_fetch_from_remote;add_rule;while(set_label ;)receiver_blueprints;
"While artists are available for retrieval, retrieve an artist with a Spotify ID, and while Japanese text requires conversion, convert the Japanese to Hiragana or Katakana and always decide not to serialize the object. Finally, set the label for a specified object.",while(get_artist;while(hiragana;_serializeExclude_eval;))set_label ;
"If conversion object can be created from the tree, create the conversion object automatically from the tree. Otherwise, create a new managed application definition and track the progress of tasks execution with a progress bar. Finally, always decide not to serialize obj.",if(from_regression;)else(create_or_update_by_id;track_progress;)_serializeExclude_eval;
"Given a frame and a compiled function code, find the corresponding function object within the frame. Then, while connection closure is required, send a delete request for the report JSON hash, as long as JSON configuration files are available for loading, load the config from existing JSON connector files.",_find_function_from_code;while(_close_connection;while(load_config_from_json;))
"If an exception needs to be set, set the exception on the future. Otherwise, compare two parameter instances.",if(set_exception;)else(parameters_equal;)
"While building MAC signature key information and fetching pages, build an MACSignatureKeyInformation struct from a dictionary and fetch the pages from the backend URL for MediaWiki >= 1.27. Finally, strip slashes from directories before updating.",while(_build_mac_signature_key_information;__fetch_1_27;)_managers_changed;
"Reject the SenderLink and destroy the handle. If OAuth2 server client information needs to be dumped, dump the oauth2server Client. Otherwise, perform perspective transform of the given PIL Image.",reject_sender;if(dump;)else(perspective;)
"Send a single file. If serialization is not required, always decide not to serialize the object. Otherwise, repeat getting an output file name as input while output file names are available for input.",_send_file;if(_serializeExclude_eval;)else(while(outfile_input;))
"If attribute retrieval is possible, get a named attribute from the object. Otherwise, return a random value for TimeField, and then repeatedly compare two parameter instances as long as comparison is necessary.",if(getattr;)else(time_field_data;while(parameters_equal;))
"Internal read CRC wrapper. Open stream, create output and finally write the stream to output. While specification creation and alert acceptance are required, create a specification dictionary for this layer and execute the wrapped code accepting an alert. Finally, look at the local directory, pick out files that have the correct start name, and summarize the results into one giant dictionary.",crcMeterRead;output_stream;while(to_spec;accept_alert;)summarizeFailedRuns;
"Estimate a lower bound on effective sample size for each independent chain. If string measurement and group creation/retrieval are needed, calculate the width of the given string in this font and create or return a group. Otherwise, create a cluster consisting of the specified number and type of Google Compute Engine instances.",effective_sample_size;if(measure_string;_all_create_or_get_group;)else(create_cluster;)
"Find the id of a group given its name by iterating on the list of subscriptions. Then, compute the SSIM value from the reference image to the target image. Finally, repeatedly execute the wrapped code, accepting an alert as long as alert acceptance is required.",__find_group_id;ssim_value;while(accept_alert;)
"Compare two parameter instances. If background erasing and image drawing are needed, draw the image as the background. Otherwise, detect the operating system.",parameters_equal;if(__on_erase_background;)else(detect_os;)
