nl,pl
"Save scanning template to filename and turn the simple logging kwargs into a log_config. Then,use a thread lock on current method if self_lock is defined. Continuously cancel all started queries that have not yet completed until they are all completed.",save_template;_change_logging_kwargs;mutex;while(cancel_query;)
"Firstly, encodes given value so it can be written to given file object . Following this, generically creates a novel parameter or result instance inferring from the type_name.Subsequently, downloads a MP4 or WebM file that is associated with the video at the URL passed .",encode_output;_create_any_param_or_result;download;
"Get a chunk from the input data converts it to a number and encodes that number. Reads FLV tags from fd or buf and returns them with adjusted timestamps if the encoding process starts,  if not, get document from index with its id_GET772210180J and tell postgres to encrypt this field using PGP. At last,wraps a function with reporting to errors backend.",_encode_chunk;if(iter_chunks;)else(do_GET;get_placeholder;)wrap_function;
"Crop the given PIL Image and resize it to desired size. in the case of resizing is complete, starts running a queue handler and creates a log file for the queue,however, while child elements exist, browse node's children within the browse node tree and build a CryptographicParameters struct from a dictionary.",resized_crop;if(_wrap_handling;)else(while(children;_build_cryptographic_parameters;))
"If the primary check succeeds, on the condition that the secondary validation fails, add failure output to XUnit test report,otherwise, reads out a row and returns a dictionary containing the row content, if not,  compute mean and variance accounting for a mask.Finally, append labels to provided Cluster Protobuf.",if(if(addFailure;)else(_trj_read_out_row;))else(moments_of_masked_time_series;)_append_label;
"Generate auth tokens are tied to the user for a specified purpose. If an authentication hash exists,decompose a TaskRecord dict into subsection of reply for get_result. Otherwise, during an ongoing filtering process, filter sqmass files and robustly compute a softmask operation.",iter_auth_hashes;if(_extract_record;)else(while(filter;softmask;))
"Convert dense Tensor to a SparseTensor by eliminating ignore_value cells. Then,conveniently get the security configuration for the specified application without the cumbersome SECURITY_ prefix. After this step,preconstruct the neuron groups.",dense_to_sparse;get_config;pre_build;
"Return a dictionary that maps each key to a list of messages. Decorporate a TaskRecord dictionary into a subsection of the reply for get_result. when establishing a key-to-messages dictionary, if a specific condition arises, use cloudpickle to serialize the non-picklable object with a wrapper,get the paragraph base embedding level and direction and set the storage to the array of chars, otherwise, read a mesh saved in the HDF5 format.",create_key_to_messages_dict;_extract_record;while(if(wrap_non_picklable_objects;get_embedding_levels;)else(read_h5;))
"When the database is in a connected state, repeat receiving a dictionary connection_params to setup a connection to the database. Subsequently, return the address with a valid checksum attached. Get a random key out of the first max_iter rows. Finally, compute the sum-square envelope of a window function using the specified hop length.",while(get_new_connection;)with_valid_checksum;get_random_available;window_sumsquare;
"Build the ¡®And¡¯ instance and search the Skype Directory for a user. While task initiation progresses, if a query yields unexpected results, retrieve messages related to an issue, otherwise, return a new Frame that fills NA along  a given axis and along a given direction with a maximum fill length.",build;search;while(if(__fetch_issue_messages;)else(fillna;))
"While data retrieval is active, update the automatically generated omim gene panel in the database, and as long as the filter application is initiated, repeat getting available filters from the dataset you've selected.",while(get_new_connection;while(get_filters;))
"When the execution context is set to true, set the log context and attempt to re-establish a connection using previously acquired tokens.",while(init_run_context;readToken;)
"Gather only metadata statements and return them. If metadata validation is true, make a function that applies a list of Bijectors forwards until the transformation sequence is initiated. Otherwise, return the string name for this dtype.",gather_metadata_statements;if(while(forward_transform_fn;))else(name;)
"When the input is a header, preserve the newlines,all others need not",while(_collapse_leading_ws;)
"Instead of overriding config options with user-specified options and getting the train operation for the given loss, if the validation check is passed, convert a file object with JSON-serialized pyschema records to a stream of pyschema objects until the data processing loop is initiated.",if(while(mr_reader;))else(__add_user_options;get_train_op;)
"Get an async client for all subscription entities in the topic. Instead of returning the string name for this dtype, if the subscription check is valid, repeat the process to download CSV files from GDocs and convert them into PO files structure until the sequential processing loop is initiated.",list_subscriptions;if(while(download;))else(name;)
"Return the training job info associated with job_name, and then print the CloudWatch logs. Additionally, save the scanning template to a filename. While monitoring the training job, return expressions for updates during network training and determine the maximum of a waveform's dependent variable vector.Finally, write api tokens to a file.",describe_training_job_with_log;save_template;while(updates;nmax;)write_tokens_to_file;
"Stop the server. Subsequently, insert a list of new documents into an existing collection in the CosmosDB database. Then, ask the user for their email and password.",stop;_ask_for_credentials;insert_documents;
"While asynchronous subscription is in progress, set the subscription to use a task per message to be processed. Upon completion of the subscription, proceed to get the label to display for a specified object. Then, upload a new service package and initiate a new deployment on either staging or production. Finally, schedule a retry.",while(subscribe_async;)get_label ;create_deployment;schedule_retry;
"For each audio file, force the audio signal down to mono. Afterward, get available filters from the dataset you've selected.",while(to_mono;)get_filters;
"When processing the data, update the automated generated omim gene panel in the database,elementwise adds list members,replacing non-finite results with alt_value until the operation is complete. Once both processes are finished, send an email using the backend specified in EMAIL_BACKEND.",while(omim;while(safe_sum;))send_email;
"When processing the data, instead of recursively iterating over all schema sub-fields, if a certain condition is met, get available filters from the dataset you've selected.",while(if(get_filters;)else(iterate_schema;))
"Node constructor to be used in tags upon successful tag validation. Otherwise, create or return a group and proceed to get deposits.",if(for_tag;)else(_all_create_or_get_group;get;)
"For each point, check whether the node import or import from the node position is correct. After completing all points, report the generated model in a human-readable form and then stop the server.",while(_check_position;)report;stop;
"Build an iterator over training batches and then stop the server. If there's a need for assignment retrieval, convert the top results from the mash screen txt output to JSON format,otherwise, get issue assignees.",build_input_pipeline;stop;if(main;)else(__get_issue_assignees;)
"If Boolean configuration conversion is required, then convert the named field to bool. Otherwise, check the continuous cutting operation. As long as this operation is true, repeatedly cut a numeric vector into categorical buckets. After completing these steps, write the XML job description to a file.",if(_convert_boolean_config_value;)else(while(cut;))write;
"While the subscription process is pending, execute the function that sets the subscription to use a task per message to be processed. After completing this process, move on to the function that gets the label to display for a specified object, and then proceed with uploading a new service package and creating a new deployment on staging or production.",while(subscribe_async;)get_label ;create_deployment;schedule_retry;
"Repeat the process of returning the training job information associated with  job_name and printing CloudWatch logs until the training job logging is completed. Then, display the Scout dashboard.For each feature, make the features beat-synchronous and create a new instance of a rule by merging two dictionaries.",while(describe_training_job_with_log;)index;while(compute_beat_sync_features;from_yaml;)
"Repeat the process of forcing an audio signal down to mono until the audio signal conversion to mono is initiated. Then, get the available filters from the dataset you've selected.",while(to_mono;)get_filters;
"when the omim gene panel update process is active,repeat the update of the automated omim gene panel in the database,continue to add list members elementwise, replacing non-finite results with an alternate value until the safe sum operation is in progress. After completing these operations, send an email using the backend specified in EMAIL_BACKEND.",while(omim;while(safe_sum;))send_email;
"If a tag-specific condition is met, execute the function for the node constructor to be used in tags, if not, creates or returns a group, and then proceed to get deposits.",if(for_tag;)else(_all_create_or_get_group;get;)
"Build an iterator over training batches ,update the automate generated omim gene panel in the database and stop the server.Instead of getting issue assignees, if the main function is called, convert top results from mash screen txt output to json format.",build_input_pipeline;omim;stop;if(main;)else(__get_issue_assignees;)
"When the file is locked, safely lock the file object.After that, create a plot of conv filters visualized as pixel arrays.",while(lock;)plot_filters;
"If a valid pair is needed, repeat getting deposits and making a nice string representation of a pair of numbers until deposits retrieval is in progress. Otherwise, retrieve the first Signature ordered by mangling descendant.",if(while(get;nice_pair;))else(first;)
"Return a list of all enrollments for the passed course SIS ID. While the information and position are being checked, get info for all filters and check whether the node import or importfrom node position is correct. Finally, get the available filters from the selected dataset.",get_enrollments_for_course_by_sis_id;while(get_info;_check_position;)get_filters;
"Convert the named field to bool if a Boolean conversion check is confirmed. Otherwise, repeat cutting a numeric vector into categorical buckets until the categorical bucketing process is in progress.Then, write the XML job description to a file instead.",if(_convert_boolean_config_value;)else(while(cut;))write;
"Return the maximum of a waveform's dependent variable vector. If maximum value calculation is required, use results from marginal ancestral inference to return a joint distribution of the sequence states at both ends of the branch. Otherwise, handle the Graphviz position attribute changing.",nmax;if(get_branch_mutation_matrix;)else(_pos_changed;)
"Handles the Graphviz position attribute changing if the position attribute has changed.Otherwise, it first creates a random sequence, then propagates a filtered distribution through a transition model, and finally gets the train operation for the given loss.",if(_pos_changed;)else(create_random_seq;kalman_transition;get_train_op;)
"Instead of downloading csv files from GDocs and convert them into po files structure, if data is not associated, associate the given client data with the item at position n if the data is already associated ,otherwise, close the queue, signalling that no more data can be put into the queue.",if(if(set_data;)else(close;))else(download;)
"While the annotations list is being built, the system reformat annotations dict to return list of corresponding zipkin_core objects and creates a MinHash which is the union of the MinHash objects passed as arguments. For each scanning template, the system saves it to the filename and returns the self object attributes not inherited as a dictionary.",while(annotation_list_builder;union;)while(save_template;dict_self;)
"When product type verification is in progress, the system gets the satellite id, returns the maximum of a waveform's dependent variable vector, and forces an audio signal down to mono.Then lock a file object safely.",while(verify_type_product;nmax;to_mono;)lock;
"Set the subscription to use a task per message to be processed. If the subscription activation is pending, download a file from the storage service to the local disk, when the YAML processing is needed, creating a new instance of a rule by merging two dictionaries.  Otherwise, create or return a group.",subscribe_async;if(download_file;while(from_yaml;))else(_all_create_or_get_group;)
"If the quantum circuit is ready for drawing, draw the quantum circuit. Otherwise, if checking for non-finite values in list, elementwise add list members, replacing non-finite results with an alternate value,if not, replace many documents in a mongo collection.",if(draw;)else(if(safe_sum;)else(replace_many;))
"Create a plot of conv filters visualized as pixel arrays. While filters are ready for visualization, repeatedly create a new instance of a rule by merging two dictionaries.Get label as  ndarray from ImageFeature and return the maximum of a waveform's dependent variable vector until the processing is completed.",plot_filters;while(from_yaml;)while(get_label;nmax;)
"In the case of leading whitespace, the description header must preserve newlines, otherwise, get course information using the Ecommerce course API. Given a LuminosoClient pointing to the root of the API, and a filename to read JSON lines from, create a project from the documents in that file.",if(_collapse_leading_ws;)else(_get_course_content_from_ecommerce;)upload_docs;
"Repeat creating an external tool using the passed json_data until the external tool creation is no longer initiated. Then, within that process, repeat saving the setting value into the database until the setting save process is completed.",while(_create_external_tool;)while(save_setting;)
Repeat adding a route to the wrapper until the route addition is no longer pending.Then save a PNG plot visualizing posterior uncertainty on heldout data.,while(add_route;)plot_heldout_prediction;
"If the interface map is available for HType generation, generate a flattened register map for HStruct, otherwise, return a new Frame that fills NA along a given axis and along a given direction with a maximum fill length. Additionally, it receives a dictionary of connection_params to set up a connection to the database.",if(HTypeFromIntfMap;)else(fillna;)get_new_connection;
"Attempt an import of the specified application. If a need for Choi representation is detected, transform a QuantumChannel to the Choi representation. Otherwise, when the font selection is not finalized, check whether the node import or import-from-node position is correct and show a dialog to select a font.",load;if(_to_choi;)else(while(_check_position;select_font;))
"Get info for all filters. While the initial setup is incomplete,calculate a subcircuit that implements this unitary, write API tokens to a file, and produce an appropriate _ProductsForm subclass for the given render type.",get_info;while(_define;write_tokens_to_file;ProductsForm;)
"When a branch mutation matrix is needed and relationships are required to be loaded, use results from marginal ancestral inference to return a joint distribution of the sequence states at both ends of the branch, and load relationships from the source XML. If issue assignees are needed, get issue assignees; otherwise, return the training job info associated with the job name and prints CloudWatch logs.",while(get_branch_mutation_matrix;_load_rels;)if(__get_issue_assignees;)else(describe_training_job_with_log;)
"Convert a file object with json serialized pyschema records into a stream of pyschema objects. If Json serialization is complete, evaluate dotted expressions at runtime and compute PSD from samples, updating the average for a given center frequency. Otherwise, if PSD computation is needed, make a function that applies a list of Bijectors forward. If not, write the XML job description to a file.",mr_reader;if(do_dots;update;)else(if(forward_transform_fn;)else(write;))
"Attempt to import the specified application if the application load is attempted. Otherwise, given a LuminosoClient pointing to the root of the API and a filename to read JSON lines from, create a project from the documents in that file and force an audio signal down to mono. Then, compute PSD from samples and update the average for the given center frequency.",if(load;)else(upload_docs;to_mono;)update;
"Attempt to re-establish a connection using previously acquired tokens. If the connection needs re-establishment, lock the file object safely and optimize by SGD AdaGrad or AdaDelta, otherwise, set up the config and load external modules,for each config not fully instantiated, return the state fidelity between two quantum states. Finally, stop the server.",readToken;if(lock;ada_family_core;)else(instantiate_config;while(state_fidelity;))stop;
"When the conversion process is in progress, convert Lisp collections into Python collections, and when the data categorization and tomography basis generation is underway, cut a numeric vector into categorical buckets, then generate a TomographyBasis object, and finally, associate the given client data with the item at position n.",while(to_py;while(cut;tomography_basis;set_data;))
"when the span conversion and copying process is ongoing, repeat converting encoded spans to a different encoding and returning a full copy of the object, optionally renaming it, if key generation is initiated, generate the key associated with the specified address; otherwise, close an existing connection, which cannot be used again once closed .",while(convert_spans;copy;if(get_key_for;)else(close;))
"Execute a code object where the inputs and behavior should match those of eval_ and exec_ until code execution is no longer in progress. If the content is ready to copy, then return a full copy of the object optionally renaming it. Otherwise, generate the key associated with the specified address.",while(execute;)if(copy;)else(get_key_for;)
"If product type verification is required, it gets the satellite id if specific product verification is needed, otherwise, it uses the node constructor for tags. If not, it converts an XML stream into a dictionary.",if(if(verify_type_product;)else(for_tag;))else(xml_to_dict;)
"Execute a code object, ensuring the inputs and behavior match those of eval_ and exec_. If the command is initiated, consolidate FLAC padding metadata blocks. Otherwise, elementwise add list members replacing non-finite results with an alternative value, and create a generator to progressively generate new keys.",execute;if(group_padding;)else(safe_sum;create_iterator;)
"When the position check and the CSV read operation are in progress, repeat checking if the node import or importfrom node position is correct, and giving a constructed CSV reader object a header row that we ve read and a detected encoding yield its rows as dictionaries.",while(_check_position;_read_csv;)
"Recursively iterate over all schema sub-fields. When the database snapshot process is in progress, repeat taking a snapshot of the database.",iterate_schema;while(snapshot;)
"If a configuration needs update, save the setting value into the database and get course information using the Ecommerce course API until the course content is updated. Otherwise, handle the Graphviz position attribute changing.",if(while(save_setting;_get_course_content_from_ecommerce;))else(_pos_changed;)
"Instead of generating a list of tags identifying those previously selected, if the configuration requires conversion and padding consolidation, convert the named field to bool and consolidate FLAC padding metadata blocks.",if(_convert_boolean_config_value;group_padding;)else(tag_list;)
"Annotate a single file, get a card, and download CSV files from GDocs, converting them into PO files structure. While emails are pending, send email using the specified backend. Subsequently, calculate a subcircuit that implements this unitary.",annotate_file;get_card;download;while(send_email;)_define;
"For each metadata processing loop initiated, if metadata statements are available, it gathers and returns them, otherwise, it schedules a retry and generates Python code for clauses.",while(if(gather_metadata_statements;)else(schedule_retry;visit_Seq;))
"If a Python script is needed, create the script from the notebook node. Otherwise, get deposits, then derive new keys or secret data from an existing managed object until all keys are derived. Finally, create a random sequence.",if(create_py;)else(get;while(derive_key;))create_random_seq;
"Update a running PowerShell command with more data and optimize by SGD AdaGrad or AdaDelta. When the file is locked, ensure it is locked safely. When processing product forms is required, produce an appropriate _ProductsForm subclass for the given render type.",update_command;ada_family_core;while(lock;)while(ProductsForm;)
"Evaluate dotted expressions at runtime. When data processing is required, save a PNG plot visualizing posterior uncertainty on heldout data, associate the given client data with the item at position n, and resolve the polytomies on the tree. Then create a random sequence and close the queue, signalling that no more data can be added.",do_dots;while(plot_heldout_prediction;set_data;resolve_polytomies;)create_random_seq;close;
"If the subscription is pending, set it to process a task per message and give the current session a name in the history database. Otherwise, show all of the credit notes that have been generated. Finally, take a snapshot of the database.",if(subscribe_async;name_session;)else(credit_note_refunds;)snapshot;
"Updates a running PowerShell command with more data, makes a nice string representation of a pair of numbers, returns an iterator on interfaces implemented by the given class node, and replaces many documents in a mongo collection. When an active session is required, it runs the model forward to return a stochastic encoding and computes the sum-square envelope of a window function at a given hop length. Finally, it receives a dictionary connection_params to set up a connection to the database.",update_command;nice_pair;interfaces;replace_many;while(call;window_sumsquare;)get_new_connection;
"Return the primary control channel of this qubit. If a featured image is required, handle the saving of the image; otherwise, run the pre-flight code specified via exec lines. Finally, return the address with a valid checksum.",control;if(save_featured_image;)else(init_code;)with_valid_checksum;
"Attempt to re-establish a connection using previously acquired tokens. If a route addition is required, adds a route to the wrapper; otherwise, while label retrieval and date modification are in progress, repeat getting label as ndarray from ImageFeature and adding a number of months to a timestamp.",readToken;if(add_route;)else(while(get_label;add_months;))
Save the setting value into the database. Repeat computing PSD from samples and updates the average for a given center frequency until the update process is started.,save_setting;while(update;)
"Queue IO write for submission to the IO executor if IO task submission pending, otherwise, get available filters from dataset you've selected instead.",if(queue_file_io_task;)else(get_filters;)
"Execute a code object; the inputs and behavior of this function should match those of eval_ and exec_. If the code object is ready for execution, return a full copy of the object, optionally renaming it. Otherwise, if unable to copy the object, safely lock the file object safely instead of retrieving information for all filters.",execute;if(copy;)else(if(lock;)else(get_info;))
"Get information for all filters and ensure that description headers preserve newlines. Repeat to disconnect internal signals so that the unit can be reused by the parent unit and override configuration options with user-specified options, until the cleaning of the subunit is initiated.",get_info;_collapse_leading_ws;while(_cleanAsSubunit;__add_user_options;)
"When settings are not yet saved, save the setting value into the database, repeat to discard data and cancels all calls until the connection is no longer open, and open the file to return an EncodableFile tuple. Finally, write the dag to the output file.",while(save_setting;while(close;)open_local_file;)dag_to_file;
"Return the self object attributes not inherited as a dict until no more self attributes are being checked. Subsequently, generate a flattened register map for HStruct.",while(dict_self;)HTypeFromIntfMap;
