nl,pl
"Recursively convert Lisp collections into Python collections. While the training job log description is ongoing, repeatedly return the training job info associated with the job name and print CloudWatch logs. If multiple document replacement is needed, replace many documents in a mongo collection; otherwise, return an iterator on interfaces implemented by the given class node.",to_py;while(describe_training_job_with_log;)if(replace_many;)else(interfaces;)
"Retrieve the first Signature ordered by mangling descendant. While API tokens are pending for file writing, repeatedly write them to a file. Subsequently, recursively iterate over all schema sub-fields.",first;while(write_tokens_to_file;)iterate_schema;
"While the update process is active, if replacement is required,  return expressions to run as updates during network training and replace many documents in a mongo collection. Otherwise, compute the sum-square envelope of a window function at a given hop length.",while(if(updates;replace_many;)else(window_sumsquare;))
"While the dag output operation is ongoing, write the dag to the output file, while the control channel check is active, return the primary control channel of this qubit.",while(dag_to_file;while(control;))
"While model processing is ongoing, if a call function is required, run the model forward to return a stochastic encoding; otherwise, convert an XML stream into a dictionary, then, return an iterator on interfaces implemented by the given class node.",while(if(call;)else(xml_to_dict;)interfaces;)
"Convert the named field to a bool. While data retrieval and processing are active, repeatedly render a fragment to HTML or return JSON describing it based on the request and write the DAG to the output file. Subsequently, return the state fidelity between two quantum states.",_convert_boolean_config_value;while(get;dag_to_file;)state_fidelity;
"Load multiple Python config files, merging each of them in turn. If configuration adjustment is needed, then if detailed reporting is required, report the generated model in human-readable form, otherwise, show all of the credit notes that have been generated. If not, return the RGBA values of the color c.",load_pyconfig_files;if(if(report;)else(credit_note_refunds;))else(lookup_color;)
"Wrap a getter to apply to the inner-most results in kernel_results, fetch the events from the server, and generate a flattened register map for HStruct. While user roles are being retrieved, get all the roles associated with the user.",make_innermost_getter;fetch;HTypeFromIntfMap;while(get_user_roles;)
"While metadata collection and processing are ongoing, gather metadata statements and return them, convert a file object with JSON serialized PySchema records to a stream of PySchema objects, and stop the server. Then, close the queue, signaling that no more data can be put into the queue. Lastly, get a re-labeled clone of this expression.",while(gather_metadata_statements;mr_reader;stop;)close;relabeled_clone;
"If a tag-based subscription is required, set the subscription to use a task per message to be processed. Otherwise, convert the XML stream into a dictionary.",if(subscribe_async;)else(xml_to_dict;)
"While the session requires data preservation and annotation, save checkpoint to file and annotate a single file.",while(save_checkpoint;annotate_file;)
"Generate python code for clauses. While data processing and analysis are ongoing, convert a file object with JSON serialized PySchema records to a stream of PySchema objects and generate a TomographyBasis object.",visit_Seq;while(mr_reader;tomography_basis;)
"Collapse leading whitespaces. Download a file from storage service to local disk. While persistent identifiers are needed, prepare persistent identifiers.",_collapse_leading_ws;download_file;while(prepare_pids;)
"When image and tree processing is needed, handle saving the featured image, convert encoded spans to a different encoding, and resolve the polytomies on the tree.",while(save_featured_image;convert_spans;resolve_polytomies;)
"When email and locking operations are ongoing, send email using backend specified in EMAIL_BACKEND and Lock a file object safely. Repeat to prepare persistent identifiers until PID preparation is complete.",while(send_email;lock;while(prepare_pids;))
"When a Graphviz position change is detected,handle the position attribute changing and retrieve available filters from the selected dataset. If argument splitting is necessary, split the command line's arguments in a shell-like manner; otherwise, render a fragment to HTML or returns JSON based on the request.",while(_pos_changed;get_filters;)if(arg_split;)else(get;)
"Use results from marginal ancestral inference to return a joint distribution of the sequence states at both ends of the branch. Generate a flattened register map for HStruct. Instead of converting the named field to bool, if a token is available, attempt to re-establish a connection using previously acquired tokens.",get_branch_mutation_matrix;HTypeFromIntfMap;if(readToken;)else(_convert_boolean_config_value;)
"Return a list of custom gate names in this gate body. Update a running PowerShell command with more data, force an audio signal down to mono if an audio signal mono conversion is required, otherwise decorate a function to automatically begin and end a task on the progressmonitor, and expand data file specs into valid data files metadata, until an update command is pending.",calls;while(update_command;if(to_mono;)else(monitored;)_get_data_files;)
"While continuing operations are required, return a list of custom gate names in this gate body if call process initiation is required, otherwise save the scanning template to a filename. Finally, update the automated gene panel in the OMIM database.",while(if(calls;)else(save_template;))omim;
"Give the current session a name in the history database if session naming is required, otherwise, while continuous OMIM update is needed, update the automated generated omim gene panel in the database.",if(name_session;)else(while(omim;))
"While features computation is ongoing, make the features beat-synchronous. While DAG output is needed, write dag to output file.",while(compute_beat_sync_features;)while(dag_to_file;)
"If a token is available, attempt to re-establish a connection using previously acquired tokens. Otherwise, make a nice string representation of a pair of numbers.",if(readToken;)else(nice_pair;)
"While processing, if an interface map is needed, run the model forward to return a stochastic encoding and generate a flattened register map for Hstruct. otherwise, show all of the credit notes that have been generated.",while(if(call;HTypeFromIntfMap;)else(credit_note_refunds;))
"Check node import or importfrom node position is correct, associate the given client data with the item at position n, while product type needs verification, get satellite id. Then, stop the server.",_check_position;set_data;while(verify_type_product;)stop;
"If random availability is checked, on the condition that the key is needed, get a random key out of the first max_iter rows, if not, add a route to the wrapper. Otherwise, return the string name for this dtype.",if(if(get_random_available;)else(add_route;))else(name;)
"Set the visible property of ticklines and ticklabels of an axis to False, verify the address with a valid checksum. If the checksum is valid, show all of the credit notes that have been generated, otherwise, attempt to re-establish a connection using previously acquired tokens.",_hide_tick_lines_and_labels;with_valid_checksum;if(credit_note_refunds;)else(readToken;)
"If code execution is ready, execute a code object where the inputs and behavior match those of eval_ and exec_. Otherwise, continue saving the setting value into the database until all settings are completed.",if(execute;)else(while(save_setting;))
"Starts the timer for this source. While the session remains active, create the python script from the notebook node if necessary, otherwise, attempt to re-establish a connection using previously acquired tokens. Finally, ensure to get a unicode string without any other content transformation and clean extra spaces.",startTimer;while(if(create_py;)else(readToken;))clean_linebreaks;
"Instead of using a node constructor for tags, if the check fails, convert the named field to a boolean if a Boolean value is needed, otherwise, convert the top results from the mash screen TXT output to JSON format. ",if(if(_convert_boolean_config_value;)else(main;))else(for_tag;)
"wrap a getter to apply to the inner-most results in kernel results, close an existing connection¡ªwhich once closed cannot be used again¡ªand return a list of all enrollments for the passed course SIS ID, repeatedly, until the process needed for enrollment operations is complete.",while(make_innermost_getter;close;get_enrollments_for_course_by_sis_id;)
"If the context requires initialization, set the log context; otherwise, continue to show all the credit notes that have been generated as long as refunds processing is ongoing, and ensure to get issue assignees. Finally, return expressions to run as updates during network training.",if(init_run_context;)else(while(credit_note_refunds;)__get_issue_assignees;)updates;
"Give the current session a name in the history database. While the connection and card retrieval are in progress, receive a dictionary connection_params to setup a connection to the database and get a card. Then, get label as ndarray from ImageFeature. Finally, close the queue, signalling that no more data can be  put into the queue.",name_session;while(get_new_connection;get_card;)get_label;close;
"Repeat getting an async client for all subscription entities in the topic, converting the named field to bool, and getting deposits as long as the subscription management cycle continues. Then, draw the quantum circuit.",while(list_subscriptions;_convert_boolean_config_value;get;)draw;
"Save the wave log and give the current session a name in the history database. If data is ready for writing, write the dag to the output file instead. Otherwise, continue to evaluate dotted expressions at runtime until dotted processing is no longer active.",wave_saver;name_session;if(dag_to_file;)else(while(do_dots;))
"Repeat opening the file to return an EncodableFile tuple, returning the address with a valid checksum attached, and propagating a filtered distribution through a transition model, until the file operation is no longer initiated.",while(open_local_file;with_valid_checksum;kalman_transition;)
"While the model state dictionary copy is initialized, copy a model state_dict to cpu, download a file from storage service to local disk, get a temp filename for atomic download until the temporary filename fetch process is initialized. Finally, set the visible property of the ticklines and ticklabels of an axis to False.",while(weights_to_cpu;download_file;while(tempfile_get;))_hide_tick_lines_and_labels;
"Get course information using the Ecommerce course API. Compute the sum-square envelope of a window function at a given hop length. Get a card. While the course content retrieval is active, if the node constructor is active, use the node constructor to be used in tags, otherwise, take a snapshot of the database.",_get_course_content_from_ecommerce;window_sumsquare;get_card;while(if(for_tag;)else(snapshot;))
"Get a satellite ID if product type verification is required; otherwise, load multiple Python config files merging each of them in turn, and handle the Graphviz position attribute changing.",if(verify_type_product;)else(load_pyconfig_files;_pos_changed;)
"While the features and documents are ready for processing, make the features beat-synchronous and insert a list of new documents into an existing collection in the CosmosDB database. Then, disconnect internal signals so the unit can be reused by the parent unit.",while(compute_beat_sync_features;insert_documents;)_cleanAsSubunit;
"Upload a new service package and create a new deployment on staging or production. While quantum states are ready for comparison, return the state fidelity between two quantum states and return a full copy of the object optionally renaming it.",create_deployment;while(state_fidelity;copy;)
"While the XML stream is ready for conversion, convert the XML stream into a dictionary and display the Scout dashboard. Get all the roles associated with the user will be executed next.",while(xml_to_dict;index;)get_user_roles;
"If the address key is generated, generate the key associated with the specified address. Otherwise, create an external tool using the passed json_data.",if(get_key_for;)else(_create_external_tool;)
"While the connection is established, set up a connection to the database with a dictionary connection_params, return the state fidelity between two quantum states, and return a list of all enrollments for the passed course sis id.",while(get_new_connection;state_fidelity;get_enrollments_for_course_by_sis_id;)
"Get messages of an issue. While the forward transformation function is ready, make a function which applies a list of Bijectors forward s. Then create a generator that can be used to progressively generate new keys.",__fetch_issue_messages;while(forward_transform_fn;)create_iterator;
"If credit note refunds are requested, show all of the credit notes that have been generated, otherwise, stop the server.",if(credit_note_refunds;)else(stop;)
"Close an existing connection; once closed, it cannot be used again. If the connection closes successfully, produce an appropriate _ProductsForm subclass for the given render type instead of reformatting annotations dict to return a list of corresponding zipkin_core objects.",close;if(ProductsForm;)else(annotation_list_builder;)
"Create the python script from the notebook node and then split a command line's arguments in a shell-like manner. While MinHash objects remain to be unioned, create a MinHash which is the union of the MinHash objects passed as arguments.",create_py;arg_split;while(union;)
"Elementwise adds list members, replacing non-finite results with alt_value. While a tag list exists, generate a list of tags identifying those previously selected and repeat the attempt to re-establish a connection using previously acquired tokens, then discard data and cancel all calls until a valid token is read, then, lock a file object safely and queue IO write for submission to the IO executor. Finally, get the satellite ID.",safe_sum;while(tag_list;while(readToken;close;)lock;queue_file_io_task;)verify_type_product;
"Download a file from the storage service to the local disk. If credit note refunds exist, show all of the credit notes that have been generated instead of returning the address with a valid checksum attached.",download_file;if(credit_note_refunds;)else(with_valid_checksum;)
"If plotting of heldout predictions is required, repeatedly save a PNG plot visualizing posterior uncertainty on heldout data until all heldout predictions have been plotted. Otherwise, download a file from the storage service to the local disk.",if(while(plot_heldout_prediction;))else(download_file;)
"If python script creation is needed, create the python script from the notebook node and repeat generating a tomography basis object until no further tomography basis generation is required, otherwise, get a temp filename for atomic download and then render a fragment to HTML or return JSON describing it based on the request.",if(create_py;while(tomography_basis;))else(tempfile_get;get;)
"If preparation of persistent identifiers is needed, prepare persistent identifiers, otherwise, render a fragment to HTML or return JSON describing it based on the request.",if(prepare_pids;)else(get;)
"If file locking is required, lock the file object safely instead of saving the scanning template to the filename. Then, get the satellite ID and repeat adding a number of months to a timestamp until no additional months need adding.",if(lock;)else(save_template;)verify_type_product;while(add_months;)
"While additional routes need adding, add a route to the wrapper and repeat returning a new Frame that fills NA along a given axis and along a given direction with a maximum fill length until the Frame data requires no further filling. Then, download CSV files from GDocs and convert them into PO files structure.",while(add_route;while(fillna;))download;
"If training job description is required, repeat returning the training job information associated with the job name and print CloudWatch logs until there are no additional training jobs to describe, otherwise, run the pre-flight code specified via exec_lines.",if(while(describe_training_job_with_log;))else(init_code;)
"While relabeling and calls are still required, get a relabeled clone of this expression and return a list of custom gate names in this gate body.",while(relabeled_clone;calls;)
"Starts the timer for this source. If timer start successful, if calls list required, return a list of custom gate names in this gate body instead of making a function which applies a list of Bijectors forward s, then Gets satellite id, otherwise, report generated model in human readable form .",startTimer;if(if(calls;)else(forward_transform_fn;)verify_type_product;)else(report;)
"While?label,?input?pipeline,?and?filter?info?are?still?required,?get?the?label?as?ndarray?from?ImageFeature,?build?an?iterator?over?training?batches,?and?get?info?for?all?filters.?Then,?cut?a?numeric?vector?into?categorical?buckets?and?search?the?Skype?Directory?for?a?user.",while(get_label;build_input_pipeline;get_info;)cut;search;
"Recursively iterate over all schema sub-fields and then convert top results from mash screen txt output to JSON format. If deep feature extraction is required, obtain a hidden layer's details on a dataset; otherwise, save the scanning template to a filename. Finally, return a list of custom gate names in this gate body.",iterate_schema;main;if(deepfeatures;)else(save_template;)calls;
"Write a report from multiple samples, reformat annotations dict to return a list of corresponding zipkin_core objects, and repeat creating a deep copy of fn until function copying is no longer needed. Lastly, add a number of months to a timestamp.",write_report;annotation_list_builder;while(_copy_fn;)add_months;
"If user role retrieval is needed, get all the roles associated with the user, otherwise, display the Scout dashboard and then get a card.",if(get_user_roles;)else(index;get_card;)
"If data setting is needed, associate the given client data with the item at position n instead of asking the user for their email and password. Then, if retrieval of the first signature is required, retrieve the first signature ordered by mangling descendant, otherwise, lock a file object safely.",if(set_data;)else(_ask_for_credentials;)if(first;)else(lock;)
"While featured image and tag list processing is needed, repeat handling the saving of the featured image and generating a list of tags identifying those previously selected. Then, set the log context.",while(save_featured_image;tag_list;)init_run_context;
"While font selection and ProductsForm processing are needed, show a dialog to select a font, obtain a hidden layer's details on a dataset, and produce an appropriate _ProductsForm subclass for the given render type.",while(select_font;deepfeatures;ProductsForm;)
"While enrollment and sequence processing are needed, repeat returning a list of all enrollments for the passed course sis ID, creating a random sequence, and repeat displaying the Scout dashboard and getting a temp filename for atomic download until Scout dashboard display and temp file generation are no longer required.",while(get_enrollments_for_course_by_sis_id;create_random_seq;while(index;tempfile_get;))
"Get a temp filename for atomic download. While local file processing is required, open the file and return an EncodableFile tuple, and if control channel access is needed, return the primary control channel of this qubit instead of using results from marginal ancestral inference to return a joint distribution of the sequence states at both ends of the branch, then set up the config and load external modules.",tempfile_get;while(open_local_file;if(control;)else(get_branch_mutation_matrix;)instantiate_config;)
"While document replacement is needed, repeat replacing many documents in a mongo collection. Then, while preparation of PIDs and building are required, repeat preparing persistent identifiers and building the And instance. Finally, recursively iterate over all schema sub-fields.",while(replace_many;)while(prepare_pids;build;)iterate_schema;
"Convert top results from mash screen txt output to JSON format. If boolean config value conversion is needed, convert the named field to bool instead of writing API tokens to a file. Lastly, get the label to display for a specified object.",main;if(_convert_boolean_config_value;)else(write_tokens_to_file;)get_label ;
"Derive a new key or secret data from an existing managed object. While key derivation and Python conversion are needed, if issue message fetching is required, get messages of the issue instead of writing the DAG to the output file and discarding data and cancelling all calls, then recursively convert Lisp collections into Python collections.",derive_key;while(if(__fetch_issue_messages;)else(dag_to_file;close;)to_py;)
"Build the And instance, return the primary control channel of this qubit, and repeat saving the setting value into the database until setting saving is no longer required.",build;control;while(save_setting;)
"While Python script creation and server stopping are needed, repeat creating the Python script from the notebook node and stopping the server. Then, if Lisp to Python conversion is required, recursively convert Lisp collections into Python collections instead of returning a new Frame that fills NA along a given axis and along a given direction with a maximum fill length. Finally, attempt an import of the specified application.",while(create_py;stop;)if(to_py;)else(fillna;)load;
"Update the automate generated omim gene panel in the database, repeat creating a MinHash which is the union of the MinHash objects passed as arguments until no MinHash union operations remain, then prepare persistent identifiers, and lastly, discard data and cancel all calls.",omim;while(union;)prepare_pids;close;
"Update the automate generated omim gene panel in the database. If document upload and deployment creation are required, create a project from the documents in the file given a LuminosoClient pointing to the root of the API and a filename to read JSON lines from, then upload a new service package and create a new deployment on staging or production, and override config options with user-specified options, otherwise, repeat getting a unicode string without any other content transformation and cleaning extra spaces until line break cleaning is no longer needed and then write the XML job description to a file.",omim;if(upload_docs;create_deployment;__add_user_options;)else(while(clean_linebreaks;)write;)
"If pyschema object conversion is needed, convert a file object with JSON-serialized pyschema records to a stream of pyschema objects, otherwise, if satellite ID verification is required, get the satellite ID instead of calling this function on the engines.",if(mr_reader;)else(if(verify_type_product;)else(connect;))
"If wave log saving is needed, save the wave log, otherwise, display the Scout dashboard and then return a list of all enrollments for the passed course sis ID.",if(wave_saver;)else(index;get_enrollments_for_course_by_sis_id;)
"If span conversion is required, convert encoded spans to a different encoding instead of returning the address with a valid checksum attached.",if(convert_spans;)else(with_valid_checksum;)
"While a processing loop is needed, if data discarding is required, discard data and cancel all calls instead of wrapping a getter so it applies to the innermost results in kernel_results.",while(if(close;)else(make_innermost_getter;))
"Create a deep copy of fn and upload a new service package and create a new deployment on staging or production. If an application import loop is required, repeat attempting an import of the specified application until there are no additional applications to import, otherwise, generate a TomographyBasis object.",_copy_fn;create_deployment;if(while(load;))else(tomography_basis;)
"Convert top results from mash screen txt output to JSON format, call this function on the engines, and if issue message retrieval is needed, get messages of the issue, otherwise, evaluate dotted expressions at runtime and then handle saving the featured image.",main;connect;if(__fetch_issue_messages;)else(do_dots;save_featured_image;)
"Evaluate dotted expressions at runtime, create a random sequence, return an instance of the class that is saved in the file with the given filename in the specified format, and set the visible property of ticklines and ticklabels of an axis to False. While Seq visitation and argument splitting are needed, repeat generating python code for clauses and repeat splitting a command line's arguments in a shell-like manner until there are no more command-line arguments to split.",do_dots;create_random_seq;load_from_file;_hide_tick_lines_and_labels;while(visit_Seq;while(arg_split;))
"If an application import loop is required, repeat attempting an import of the specified application until there are no additional applications to import, otherwise, close the queue signaling that no more data can be put into the queue.",if(while(load;))else(close;)
